{
  "model_id": "dm-240002e49353",
  "tenant_id": "validation-tokyo-2026",
  "decision_id": "da-389dbc703b18",
  "question": "how to make italian coffee",
  "constraints": {
    "desired_outcome": "Contract audit CASE-003"
  },
  "options": [
    {
      "option_id": "opt-record-method",
      "statement": "Create Italian coffee preparation knowledge covering brewing method, ingredients, equipment and technique.",
      "evidence_refs": [
        "live-web-0",
        "live-web-1",
        "live-web-2",
        "live-web-3",
        "live-web-4",
        "live-web-5"
      ]
    },
    {
      "option_id": "opt-try-alternate",
      "statement": "Create comparative Italian coffee technique knowledge before committing to one brew method.",
      "evidence_refs": [
        "live-web-0",
        "live-web-1",
        "live-web-2",
        "live-web-3",
        "live-web-4",
        "live-web-5"
      ]
    }
  ],
  "chosen_option": {
    "option_id": "opt-record-method",
    "statement": "Create Italian coffee preparation knowledge covering brewing method, ingredients, equipment and technique.",
    "evidence_refs": [
      "live-web-0",
      "live-web-1",
      "live-web-2",
      "live-web-3",
      "live-web-4",
      "live-web-5"
    ]
  },
  "rationale": "CASE-003 human approve contract audit",
  "evidence_refs": [
    "live-web-0",
    "live-web-1",
    "live-web-2",
    "live-web-3",
    "live-web-4",
    "live-web-5"
  ],
  "knowledge_ref": "kn-3ccc2e9796831926aad075478632a81d@1.0.0",
  "approval_ref": "hrd-3ccc2e9796831926aad075478632a81d@1.0.0",
  "actor_id": "audit-case-003",
  "outcome_status": "recorded",
  "created_at": "2026-07-27T05:30:35.300Z",
  "version": "0.1.0",
  "decision_asset_ref": "da-389dbc703b18",
  "user_id": "audit-case-003",
  "lineage": {
    "correlation_id": "CONTRACT-AUDIT-CASE-003",
    "research_brief_ref": "brief-CONTRACT-AUDIT-CASE-003@1.0.0",
    "research_report_ref": "e82d1166efcb112316e936f9d179d3b3@1.0.0",
    "validation_report_ref": "knowledge-ingestion-stage-2@1.0.0",
    "proposal_ref": "knowledge-ingestion-stage-3@1.0.0",
    "human_decision_ref": "hrd-3ccc2e9796831926aad075478632a81d@1.0.0",
    "knowledge_ref": "kn-3ccc2e9796831926aad075478632a81d@1.0.0",
    "graph_update_ref": "gu-3ccc2e9796831926aad075478632a81d@1.0.0"
  },
  "graph_update_ref": "gu-3ccc2e9796831926aad075478632a81d@1.0.0"
}
