{
  "model_id": "dm-9735e95f3d78",
  "tenant_id": "validation-tokyo-2026",
  "decision_id": "da-53b364096ebf",
  "question": "how to get japan working visa",
  "constraints": {
    "location": "Tokyo",
    "timeframe": "2026",
    "desired_outcome": "visa applicaito difference"
  },
  "options": [
    {
      "option_id": "opt-package-approve",
      "statement": "Human approved Decision Asset package as decision-ready (no automated ranking)",
      "evidence_refs": [
        "mock-web-0",
        "mock-web-1",
        "mock-github-0",
        "mock-github-1",
        "mock-reddit-0",
        "mock-reddit-1"
      ]
    },
    {
      "option_id": "opt-claim-000",
      "statement": "Mock evidence 1 for: how to get japan working visa",
      "claim_id": "claim-000",
      "evidence_refs": [
        "mock-web-0"
      ]
    },
    {
      "option_id": "opt-claim-001",
      "statement": "Mock evidence 2 for: how to get japan working visa",
      "claim_id": "claim-001",
      "evidence_refs": [
        "mock-web-1"
      ]
    },
    {
      "option_id": "opt-claim-002",
      "statement": "Mock evidence 1 for: how to get japan working visa",
      "claim_id": "claim-002",
      "evidence_refs": [
        "mock-github-0"
      ]
    },
    {
      "option_id": "opt-claim-003",
      "statement": "Mock evidence 2 for: how to get japan working visa",
      "claim_id": "claim-003",
      "evidence_refs": [
        "mock-github-1"
      ]
    },
    {
      "option_id": "opt-claim-004",
      "statement": "Mock evidence 1 for: how to get japan working visa",
      "claim_id": "claim-004",
      "evidence_refs": [
        "mock-reddit-0"
      ]
    },
    {
      "option_id": "opt-claim-005",
      "statement": "Mock evidence 2 for: how to get japan working visa",
      "claim_id": "claim-005",
      "evidence_refs": [
        "mock-reddit-1"
      ]
    }
  ],
  "chosen_option": {
    "option_id": "opt-package-approve",
    "statement": "Human approved Decision Asset package as decision-ready (no automated ranking)",
    "evidence_refs": [
      "mock-web-0",
      "mock-web-1",
      "mock-github-0",
      "mock-github-1",
      "mock-reddit-0",
      "mock-reddit-1"
    ]
  },
  "rationale": "Actor web-mvp-user approved proposal da-53b364096ebf. Decision Model v0.1 records the approved Decision Asset package snapshot. No prediction or recommendation engine involved.",
  "evidence_refs": [
    "mock-web-0",
    "mock-web-1",
    "mock-github-0",
    "mock-github-1",
    "mock-reddit-0",
    "mock-reddit-1"
  ],
  "knowledge_ref": "kn-a6acd4f3b927f09b3df644da80f56032@1.0.0",
  "approval_ref": "hrd-a6acd4f3b927f09b3df644da80f56032@1.0.0",
  "actor_id": "web-mvp-user",
  "outcome_status": "recorded",
  "created_at": "2026-07-27T02:03:20.512Z",
  "version": "0.1.0",
  "decision_asset_ref": "da-53b364096ebf",
  "user_id": "web-mvp-user",
  "lineage": {
    "correlation_id": "WEB-ms2l17mu-654gop",
    "research_brief_ref": "brief-WEB-ms2l17mu-654gop@1.0.0",
    "research_report_ref": "69d7e35cecba483787c5dd0c86eddc12@1.0.0",
    "validation_report_ref": "knowledge-ingestion-stage-2@1.0.0",
    "proposal_ref": "knowledge-ingestion-stage-3@1.0.0",
    "human_decision_ref": "hrd-a6acd4f3b927f09b3df644da80f56032@1.0.0",
    "knowledge_ref": "kn-a6acd4f3b927f09b3df644da80f56032@1.0.0",
    "graph_update_ref": "gu-a6acd4f3b927f09b3df644da80f56032@1.0.0"
  },
  "graph_update_ref": "gu-a6acd4f3b927f09b3df644da80f56032@1.0.0"
}
