{
  "model_id": "dm-30f882852c60",
  "tenant_id": "validation-tokyo-2026",
  "decision_id": "da-8525f1d8baed",
  "question": "Which AI startup opportunity has the highest probability of success for a solo founder in Tokyo in 2026?",
  "constraints": {
    "location": "Tokyo",
    "founderType": "solo technical founder",
    "timeframe": "2026",
    "required_sources": [
      "web",
      "github",
      "reddit"
    ]
  },
  "options": [
    {
      "option_id": "opt-package-approve",
      "statement": "Human approved Decision Asset package as decision-ready (no automated ranking)",
      "evidence_refs": [
        "live-web-0",
        "live-github-0"
      ]
    },
    {
      "option_id": "opt-claim-000",
      "statement": "<!doctype html><html lang=\"en\"><head><title>Example Domain</title><link rel=\"icon\" href=\"data:,\"><meta name=\"viewport\" content=\"width=device-width, initial-scale=1\"><style>body{background:#eee;width:60vw;margin:15vh auto;font-family:system-",
      "claim_id": "claim-000",
      "evidence_refs": [
        "live-web-0"
      ]
    },
    {
      "option_id": "opt-claim-001",
      "statement": "Spark is a prototype navigation app that helps drivers find available parking spaces using AI-powered predictions. It was created during the DMZ × JVA Startup Hackathon held in Tokyo, Japan (Oct 11–12, 2025) — a two-day startup challenge fo",
      "claim_id": "claim-001",
      "evidence_refs": [
        "live-github-0"
      ]
    }
  ],
  "chosen_option": {
    "option_id": "opt-package-approve",
    "statement": "Human approved Decision Asset package as decision-ready (no automated ranking)",
    "evidence_refs": [
      "live-web-0",
      "live-github-0"
    ]
  },
  "rationale": "Actor founder approved proposal da-8525f1d8baed. Decision Model v0.1 records the approved Decision Asset package snapshot. No prediction or recommendation engine involved.",
  "evidence_refs": [
    "live-web-0",
    "live-github-0"
  ],
  "knowledge_ref": "kn-98f9ffd236c93ee56092188440e94b37@1.0.0",
  "approval_ref": "hrd-98f9ffd236c93ee56092188440e94b37@1.0.0",
  "actor_id": "founder",
  "outcome_status": "recorded",
  "created_at": "2026-07-27T02:19:53.672Z",
  "version": "0.1.0",
  "decision_asset_ref": "da-8525f1d8baed",
  "user_id": "founder",
  "lineage": {
    "correlation_id": "USER-REQUEST-LIVE-001",
    "research_brief_ref": "brief-USER-REQUEST-LIVE-001@1.0.0",
    "research_report_ref": "014e0a1d5bc4b79c638ad88244f233aa@1.0.0",
    "validation_report_ref": "knowledge-ingestion-stage-2@1.0.0",
    "proposal_ref": "knowledge-ingestion-stage-3@1.0.0",
    "human_decision_ref": "hrd-98f9ffd236c93ee56092188440e94b37@1.0.0",
    "knowledge_ref": "kn-98f9ffd236c93ee56092188440e94b37@1.0.0",
    "graph_update_ref": "gu-98f9ffd236c93ee56092188440e94b37@1.0.0"
  },
  "graph_update_ref": "gu-98f9ffd236c93ee56092188440e94b37@1.0.0"
}
