{
  "model_id": "dm-313304b3517f",
  "tenant_id": "validation-tokyo-2026",
  "decision_id": "da-e9d1bf6de513",
  "question": "Should I build an AI startup in Tokyo or continue employment?",
  "constraints": {
    "desired_outcome": "Contract audit CASE-002"
  },
  "options": [
    {
      "option_id": "opt-pursue-build",
      "statement": "Create Tokyo AI startup decision knowledge recording a build-now path versus employment baseline.",
      "evidence_refs": [
        "live-github-2",
        "live-github-3",
        "live-github-5",
        "live-github-7"
      ]
    },
    {
      "option_id": "opt-validate-first",
      "statement": "Create Tokyo AI startup decision knowledge recording continue-employment / validate-first before full build.",
      "evidence_refs": [
        "live-github-2",
        "live-github-3",
        "live-github-5",
        "live-github-7"
      ]
    }
  ],
  "chosen_option": {
    "option_id": "opt-pursue-build",
    "statement": "Create Tokyo AI startup decision knowledge recording a build-now path versus employment baseline.",
    "evidence_refs": [
      "live-github-2",
      "live-github-3",
      "live-github-5",
      "live-github-7"
    ]
  },
  "rationale": "CASE-002 human approve contract audit",
  "evidence_refs": [
    "live-github-2",
    "live-github-3",
    "live-github-5",
    "live-github-7"
  ],
  "knowledge_ref": "kn-fe502a1ea298ca762ac59fec2a23c3aa@1.0.0",
  "approval_ref": "hrd-fe502a1ea298ca762ac59fec2a23c3aa@1.0.0",
  "actor_id": "audit-case-002",
  "outcome_status": "recorded",
  "created_at": "2026-07-27T05:30:31.462Z",
  "version": "0.1.0",
  "decision_asset_ref": "da-e9d1bf6de513",
  "user_id": "audit-case-002",
  "lineage": {
    "correlation_id": "CONTRACT-AUDIT-CASE-002",
    "research_brief_ref": "brief-CONTRACT-AUDIT-CASE-002@1.0.0",
    "research_report_ref": "ffb7bb4038fa36278e24919f94b50088@1.0.0",
    "validation_report_ref": "knowledge-ingestion-stage-2@1.0.0",
    "proposal_ref": "knowledge-ingestion-stage-3@1.0.0",
    "human_decision_ref": "hrd-fe502a1ea298ca762ac59fec2a23c3aa@1.0.0",
    "knowledge_ref": "kn-fe502a1ea298ca762ac59fec2a23c3aa@1.0.0",
    "graph_update_ref": "gu-fe502a1ea298ca762ac59fec2a23c3aa@1.0.0"
  },
  "graph_update_ref": "gu-fe502a1ea298ca762ac59fec2a23c3aa@1.0.0"
}
